fig_id,claim_id,art_ids,stat_ids,panel_structure,placement,recipe,render_path,engine_version,engine_commit,drift_ok,rejected_alternative
FIG-001,CLM-0001;CLM-0005,ART-0025;ART-0026;ART-0016;ART-0017,pending_stage9.22,A method object and input contract; B residence-window metrics; C failure modes and interpretation boundaries; D executable truth-case ladder.,main,panelforge:alternative_hypothesis_exclusion_table+conceptual_triptych+methods_pipeline_flow+panel_provenance_ledger_table,manuscript/nature_methods/figures/rendered/FIG-001/FIG-001.svg,panelforge-figures@v3.14.1,d8ab4c5d25be6243aa7209ad1ee6af144820c920,accepted_stage9.6b,"Do not use a text-only workflow schematic because the method object needs explicit input, output, and limitation panels."
FIG-002,CLM-0001;CLM-0004,ART-0027;ART-0028;ART-0029;ART-0030;ART-0031,pending_stage9.22,A synthetic regime grid; B residence-versus-amplitude benchmark; C reduced-alternative comparison; D negative and ambiguous failure behavior.,main,panelforge:alternative_hypothesis_exclusion_table+conceptual_triptych+model_comparison_aic_bic_ladder+sobol_first_total_pair,manuscript/nature_methods/figures/rendered/FIG-002/FIG-002.svg,panelforge-figures@v3.14.1,d8ab4c5d25be6243aa7209ad1ee6af144820c920,accepted_stage9.6b,Do not collapse the benchmark to a single score because ambiguity and failure behavior must remain visible.
FIG-003,CLM-0001,ART-0032;ART-0033;ART-0034;ART-0035,pending_stage9.22,A public-data adapter map; B DRG calcium residence-amplitude separation; C ERK GPCR residence-amplitude separation; D window-sensitivity and uncertainty summary.,main,panelforge:methods_pipeline_flow+panel_provenance_ledger_table+sobol_first_total_pair,manuscript/nature_methods/figures/rendered/FIG-003/FIG-003.svg,panelforge-figures@v3.14.1,d8ab4c5d25be6243aa7209ad1ee6af144820c920,accepted_stage9.6b,Do not present only the RhoA reference use case because the methods claim requires independent public live-cell systems.
FIG-004,CLM-0002;CLM-0003;CLM-0004,ART-0036;ART-0037;ART-0038;ART-0039;ART-0040;ART-0049;ART-0050;ART-0051,pending_stage9.22,A endpoint schema contract; B bounded-coupling decisions under declared margins; C reserve-like endpoint coordinate; D routed-output reduced-architecture comparison; E measurement-scoped limitations.,main,panelforge:alternative_hypothesis_exclusion_table+conceptual_triptych+equivalence_forest_with_tost_bounds+hierarchical_effect_size_ladder+model_comparison_aic_bic_ladder,manuscript/nature_methods/figures/rendered/FIG-004/FIG-004.svg,panelforge-figures@v3.14.1,d8ab4c5d25be6243aa7209ad1ee6af144820c920,accepted_stage9.6b,"Do not split bounded coupling, reserve-like behavior, and routed-output comparison into isolated main figures because their shared endpoint contract is the method point."
FIG-005,CLM-0002,ART-0041;ART-0042;ART-0043;ART-0044;ART-0048,pending_stage9.22,A held-out analysis plan; B bounded-coupling pass contexts; C inconclusive margin-boundary contexts; D margin sensitivity; E controlled-access boundary.,main,panelforge:alternative_hypothesis_exclusion_table+equivalence_forest_with_tost_bounds+methods_pipeline_flow+panel_provenance_ledger_table+sobol_first_total_pair,manuscript/nature_methods/figures/rendered/FIG-005/FIG-005.svg,panelforge-figures@v3.14.1,d8ab4c5d25be6243aa7209ad1ee6af144820c920,accepted_stage9.6b,Do not bury held-out inconclusive cases in supplement because they define the method boundary for bounded-coupling decisions.
FIG-006,CLM-0005,ART-0045;ART-0046;ART-0047;ART-0052;ART-0053;ART-0010;ART-0021;ART-0022;ART-0023;ART-0024,pending_stage9.22,"A Python, CLI, backend, and workbench parity; B export bundle anatomy; C source-distribution clean-room reproduction; D archive and checksum provenance; E adoption and user-path rehearsal.",main,panelforge:alternative_hypothesis_exclusion_table+conceptual_triptych+methods_pipeline_flow+model_comparison_aic_bic_ladder+panel_provenance_ledger_table,manuscript/nature_methods/figures/rendered/FIG-006/FIG-006.svg,panelforge-figures@v3.14.1,d8ab4c5d25be6243aa7209ad1ee6af144820c920,accepted_stage9.6b,Do not treat software maturity as availability text only because the methods claim requires visible reproducibility and adoption evidence.
